{
  "source": {
    "repository": "Cratis/Fundamentals",
    "commit": "d2accc4a79b6bcf2708213c97093ab5ba6c06381",
    "package": "source extraction, not a published package"
  },
  "runtime": {
    "framework": ".NET 10.0.12",
    "environmentVersion": "10.0.12",
    "architecture": "Arm64",
    "os": "macOS 26.6.2",
    "jsonAssembly": "System.Text.Json, Version=10.0.0.0, Culture=neutral, PublicKeyToken=cc7b13ffcd2ddd51",
    "jsonInformationalVersion": "10.0.12\u002B95017c711e6afc1085133d440e42b4bd78155701",
    "culture": ""
  },
  "enumDefinitions": [
    {
      "name": "Plain",
      "backing": "Int32",
      "flags": false,
      "members": [
        {
          "name": "Zero",
          "numeric": "0"
        },
        {
          "name": "One",
          "numeric": "1"
        },
        {
          "name": "Two",
          "numeric": "2"
        },
        {
          "name": "Max",
          "numeric": "2147483647"
        },
        {
          "name": "Min",
          "numeric": "-2147483648"
        }
      ]
    },
    {
      "name": "NoZero",
      "backing": "Int32",
      "flags": false,
      "members": [
        {
          "name": "One",
          "numeric": "1"
        }
      ]
    },
    {
      "name": "Bits",
      "backing": "Int32",
      "flags": true,
      "members": [
        {
          "name": "None",
          "numeric": "0"
        },
        {
          "name": "A",
          "numeric": "1"
        },
        {
          "name": "B",
          "numeric": "2"
        },
        {
          "name": "AB",
          "numeric": "3"
        },
        {
          "name": "C",
          "numeric": "4"
        }
      ]
    },
    {
      "name": "ByteEnum",
      "backing": "Byte",
      "flags": false,
      "members": [
        {
          "name": "Zero",
          "numeric": "0"
        },
        {
          "name": "One",
          "numeric": "1"
        },
        {
          "name": "Max",
          "numeric": "255"
        }
      ]
    },
    {
      "name": "UIntEnum",
      "backing": "UInt32",
      "flags": false,
      "members": [
        {
          "name": "Zero",
          "numeric": "0"
        },
        {
          "name": "One",
          "numeric": "1"
        },
        {
          "name": "High",
          "numeric": "2147483648"
        },
        {
          "name": "Max",
          "numeric": "4294967295"
        }
      ]
    },
    {
      "name": "LongEnum",
      "backing": "Int64",
      "flags": false,
      "members": [
        {
          "name": "Zero",
          "numeric": "0"
        },
        {
          "name": "One",
          "numeric": "1"
        },
        {
          "name": "High",
          "numeric": "2147483648"
        },
        {
          "name": "Max",
          "numeric": "9223372036854775807"
        },
        {
          "name": "Low",
          "numeric": "-2147483649"
        },
        {
          "name": "Negative",
          "numeric": "-1"
        }
      ]
    }
  ],
  "count": 236,
  "cases": [
    {
      "operation": "read",
      "mode": "bare",
      "enumType": "Plain",
      "input": "0",
      "accepted": true,
      "numeric": "0",
      "display": "Zero",
      "output": {
        "accepted": true,
        "json": "0"
      }
    },
    {
      "operation": "read",
      "mode": "concept",
      "enumType": "Plain",
      "input": "0",
      "accepted": true,
      "numeric": "0",
      "display": "Zero",
      "output": {
        "accepted": true,
        "json": "0"
      }
    },
    {
      "operation": "read",
      "mode": "bare",
      "enumType": "Plain",
      "input": "1",
      "accepted": true,
      "numeric": "1",
      "display": "One",
      "output": {
        "accepted": true,
        "json": "1"
      }
    },
    {
      "operation": "read",
      "mode": "concept",
      "enumType": "Plain",
      "input": "1",
      "accepted": true,
      "numeric": "1",
      "display": "One",
      "output": {
        "accepted": true,
        "json": "1"
      }
    },
    {
      "operation": "read",
      "mode": "bare",
      "enumType": "Plain",
      "input": "9",
      "accepted": false,
      "error": {
        "type": "System.Text.Json.JsonException",
        "message": "Unable to convert \u00229\u0022 to Enum \u0022Plain\u0022. Value is not defined.",
        "innerType": null,
        "innerMessage": null
      }
    },
    {
      "operation": "read",
      "mode": "concept",
      "enumType": "Plain",
      "input": "9",
      "accepted": true,
      "numeric": "9",
      "display": "9",
      "output": {
        "accepted": true,
        "json": "9"
      }
    },
    {
      "operation": "read",
      "mode": "bare",
      "enumType": "Plain",
      "input": "-1",
      "accepted": false,
      "error": {
        "type": "System.Text.Json.JsonException",
        "message": "Unable to convert \u0022-1\u0022 to Enum \u0022Plain\u0022. Value is not defined.",
        "innerType": null,
        "innerMessage": null
      }
    },
    {
      "operation": "read",
      "mode": "concept",
      "enumType": "Plain",
      "input": "-1",
      "accepted": true,
      "numeric": "-1",
      "display": "-1",
      "output": {
        "accepted": true,
        "json": "-1"
      }
    },
    {
      "operation": "read",
      "mode": "bare",
      "enumType": "Plain",
      "input": "2147483647",
      "accepted": true,
      "numeric": "2147483647",
      "display": "Max",
      "output": {
        "accepted": true,
        "json": "2147483647"
      }
    },
    {
      "operation": "read",
      "mode": "concept",
      "enumType": "Plain",
      "input": "2147483647",
      "accepted": true,
      "numeric": "2147483647",
      "display": "Max",
      "output": {
        "accepted": true,
        "json": "2147483647"
      }
    },
    {
      "operation": "read",
      "mode": "bare",
      "enumType": "Plain",
      "input": "-2147483648",
      "accepted": true,
      "numeric": "-2147483648",
      "display": "Min",
      "output": {
        "accepted": true,
        "json": "-2147483648"
      }
    },
    {
      "operation": "read",
      "mode": "concept",
      "enumType": "Plain",
      "input": "-2147483648",
      "accepted": true,
      "numeric": "-2147483648",
      "display": "Min",
      "output": {
        "accepted": true,
        "json": "-2147483648"
      }
    },
    {
      "operation": "read",
      "mode": "bare",
      "enumType": "Plain",
      "input": "2147483648",
      "accepted": false,
      "error": {
        "type": "System.Text.Json.JsonException",
        "message": "The JSON value could not be converted to Plain. Path: $ | LineNumber: 0 | BytePositionInLine: 10.",
        "innerType": "System.FormatException",
        "innerMessage": "Either the JSON value is not in a supported format, or is out of bounds for an Int32."
      }
    },
    {
      "operation": "read",
      "mode": "concept",
      "enumType": "Plain",
      "input": "2147483648",
      "accepted": false,
      "error": {
        "type": "System.Text.Json.JsonException",
        "message": "The JSON value could not be converted to PlainConcept. Path: $ | LineNumber: 0 | BytePositionInLine: 10.",
        "innerType": "System.FormatException",
        "innerMessage": "Either the JSON value is not in a supported format, or is out of bounds for an Int32."
      }
    },
    {
      "operation": "read",
      "mode": "bare",
      "enumType": "Plain",
      "input": "-2147483649",
      "accepted": false,
      "error": {
        "type": "System.Text.Json.JsonException",
        "message": "The JSON value could not be converted to Plain. Path: $ | LineNumber: 0 | BytePositionInLine: 11.",
        "innerType": "System.FormatException",
        "innerMessage": "Either the JSON value is not in a supported format, or is out of bounds for an Int32."
      }
    },
    {
      "operation": "read",
      "mode": "concept",
      "enumType": "Plain",
      "input": "-2147483649",
      "accepted": false,
      "error": {
        "type": "System.Text.Json.JsonException",
        "message": "The JSON value could not be converted to PlainConcept. Path: $ | LineNumber: 0 | BytePositionInLine: 11.",
        "innerType": "System.FormatException",
        "innerMessage": "Either the JSON value is not in a supported format, or is out of bounds for an Int32."
      }
    },
    {
      "operation": "read",
      "mode": "bare",
      "enumType": "Plain",
      "input": "\u0022One\u0022",
      "accepted": true,
      "numeric": "1",
      "display": "One",
      "output": {
        "accepted": true,
        "json": "1"
      }
    },
    {
      "operation": "read",
      "mode": "concept",
      "enumType": "Plain",
      "input": "\u0022One\u0022",
      "accepted": true,
      "numeric": "1",
      "display": "One",
      "output": {
        "accepted": true,
        "json": "1"
      }
    },
    {
      "operation": "read",
      "mode": "bare",
      "enumType": "Plain",
      "input": "\u0022one\u0022",
      "accepted": true,
      "numeric": "1",
      "display": "One",
      "output": {
        "accepted": true,
        "json": "1"
      }
    },
    {
      "operation": "read",
      "mode": "concept",
      "enumType": "Plain",
      "input": "\u0022one\u0022",
      "accepted": false,
      "error": {
        "type": "System.ArgumentException",
        "message": "Requested value \u0027one\u0027 was not found.",
        "innerType": null,
        "innerMessage": null
      }
    },
    {
      "operation": "read",
      "mode": "bare",
      "enumType": "Plain",
      "input": "\u0022ONE\u0022",
      "accepted": true,
      "numeric": "1",
      "display": "One",
      "output": {
        "accepted": true,
        "json": "1"
      }
    },
    {
      "operation": "read",
      "mode": "concept",
      "enumType": "Plain",
      "input": "\u0022ONE\u0022",
      "accepted": false,